Name,Description
Alpha Rampage,"Alpha Rampage is a 'Brute Action – Attack' card from the 'Welcome to Rathe' set. It costs 3, pitches for 1, defends for 3, has 9 power, and has the abilities; **Rhinar Specialization**

As an additional cost to play Alpha Rampage, discard a random card.

When you attack with Alpha Rampage, **intimidate**."
Ancestral Empowerment,"Ancestral Empowerment is a 'Ninja – Attack Reaction' card from the 'Welcome to Rathe' set. It costs 0, pitches for 1, defends for 3, has None power, and has the abilities; Target Ninja attack action card gains +1{p}.

Draw a card."
